{
  "dataset": "OTRF Security-Datasets (mordor / atomic)",
  "sources": [
    {
      "sensor": "single",
      "source_log": "datasets/atomic/windows/discovery/host/cmd_discover_iexplorer_version_registry.zip",
      "sha256": "3215b22ff18ea946923431a51edc83e3e0ba5d4b559ff1d6b7d27c16cc5803da"
    }
  ],
  "primary_host": "WORKSTATION5",
  "tier": {
    "tier": 1,
    "sensors": [
      "sysmon"
    ]
  }
}