{
  "dataset": "Splunk Attack Data (attack_techniques)",
  "sources": [
    {
      "sensor": "single",
      "source_log": "attack_data-master/datasets/attack_techniques/T1105/atomic_red_team/windows-sysmon_curl.log",
      "sha256": "8f13a7382e2c6c2b32353971cd642fad77e929c7c26e37989bbeace4a0f381f5"
    }
  ],
  "primary_host": "win-dc-469.attackrange.local",
  "tier": {
    "tier": 1,
    "sensors": [
      "Sysmon"
    ],
    "why_single_source": "windows-sysmon_curl.log is host win-dc-469, Sysmon only (EID 1 process-create + EID 11 file-create used; EID 7/10/12 curl-internal noise excluded). Single host, single sensor, verified."
  }
}