{
  "dataset": "Splunk Attack Data (attack_techniques)",
  "sources": [
    {
      "sensor": "single",
      "source_log": "attack_data-master/datasets/attack_techniques/T1547.001/atomic_red_team/windows-sysmon.log",
      "sha256": "11d8c6f7ca60994936ae9332ea67e5c220027ae1addad48203df6bdde9d46f5d"
    }
  ],
  "primary_host": "win-dc-942.attackrange.local",
  "tier": {
    "tier": 1,
    "sensors": [
      "Sysmon"
    ],
    "why_single_source": "single host win-dc-942 (6,287 events)."
  }
}